<?xml version="1.0" encoding="UTF-8"?> 

<matche xmlns:xsi="http://www.w3.org/2001/XMLSchema-instance" xsi:noNamespaceSchemaLocation="matche.xsd"> 
   <id>3029246</id> 
   <competition_id>17429</competition_id> 
   <date>2019-12-21</date> 
   <time>12:30:00</time> 
   <status>Played</status> 
   <stadium></stadium> 
   <winner>draw</winner> 
 
   <team_a id="674" score="0" /> 
   <team_b id="660" score="0" /> 
</matche>