<?xml version="1.0" encoding="UTF-8"?> 

<matche xmlns:xsi="http://www.w3.org/2001/XMLSchema-instance" xsi:noNamespaceSchemaLocation="matche.xsd"> 
   <id>3047023</id> 
   <competition_id>17512</competition_id> 
   <date>2019-08-17</date> 
   <time>16:30:00</time> 
   <status>Played</status> 
   <winner>draw</winner> 
   <stadium></stadium> 
   <team_a id="971" /> 
   <team_b id="966" /> 
</matche>