<?xml version="1.0" encoding="UTF-8"?> 

<matche xmlns:xsi="http://www.w3.org/2001/XMLSchema-instance" xsi:noNamespaceSchemaLocation="matche.xsd"> 
   <id>3111996</id> 
   <competition_id>17886</competition_id> 
   <date>2020-04-05</date> 
   <time>18:45:00</time> 
   <status>Fixture</status> 
   <stadium></stadium> 
   <winner>yet unknown</winner> 
 
   <team_a id="1245" score="" /> 
   <team_b id="1240" score="" /> 
</matche>